name,definition,clinical_stage
Protein Refolding,,PRECLINICAL
Amino Acid Analysis (AAA),Determination of amino acid composition of samples containing proteins or amino acids,PRECLINICAL
Lipids Synthesis,,PRECLINICAL
Intermediates Synthesis,,PRECLINICAL
Organic Synthesis,,PRECLINICAL
Chemical Recycling,,BOTH
Viral Clearance Studies,,PRECLINICAL
Immunotoxicology,,PRECLINICAL
Swine Models,"The use of pigs in biomedical research as models for human diseases and conditions, owing to their physiological and anatomical similarities to humans, which make them valuable for studying cardiovascular diseases, organ transplantation, and surgical techniques.",PRECLINICAL
Animal Model Housing,"The provision of specialized environments and care for laboratory animals used in research, ensuring appropriate conditions for their health and well-being, including regulated temperature, humidity, light cycles, and enrichment activities.",PRECLINICAL
Custom Animal Model Development,Developing specialized study designs and animal models tailored to specific research needs.,PRECLINICAL
Genetically Engineered Animal Models,Animals engineered to carry genes that cause or predispose them to specific diseases.,PRECLINICAL
Pharmacokinetic/Pharmacodynamic (PK/PD) Animal Models,"These models are used to understand the dynamics of drug absorption, distribution, metabolism, and excretion, as well as the drug's biochemical and physiological effects.",PRECLINICAL
Data Safety Monitoring Boards (DSMBs),,CLINICAL
Quality Management Systems (QMS) and Quality Assurance (QA),,CLINICAL
Amination,,PRECLINICAL
Cell and Gene Therapies (CAGT),,CLINICAL
Dermatology,,CLINICAL
Materials Chemicals Testing,,BOTH
Gastrointestinal,,CLINICAL
Hepatology,,CLINICAL
Immunology,,CLINICAL
NASH/MASH,,CLINICAL
Gynecology,,CLINICAL
Pain Management,,CLINICAL
Organ Transplant,,CLINICAL
Orthopedics,,CLINICAL
Dentistry,,CLINICAL
Endocrinology,,CLINICAL
Pediatrics and Geriatrics,,CLINICAL
Allergy,,CLINICAL
"Phase IV, Real-World Evidence and Registry",,CLINICAL
Cardiology,,CLINICAL
Neurology,,CLINICAL
Urology,,CLINICAL
Nephrology,,CLINICAL
Topical and Inhalation Safety and Tolerability Studies,,BOTH
Protein Engineering,Use of directed evolution and rational design to create proteins with enhanced properties or new functionalities,PRECLINICAL
Fertilizer Analysis,,BOTH
Thermal Shift Assay (TSA),Assessment of the thermal stability of proteins,PRECLINICAL
Clinical Pharmacokinetics,Studies during clinical trials to inform dosing regimens and therapeutic strategies,CLINICAL
Soil Fertility Analysis,Evaluation of the health and nutrient content of soil,BOTH
Agriculture and Live Stock Genotyping,"The use of genetic testing to analyze and identify genetic variations in crops and livestock, aiding in breeding programs, trait selection, and improving productivity and disease resistance.",BOTH
Crop Genetic Improvement,"The application of genetic tools and techniques to enhance crop traits such as yield, disease resistance, and environmental adaptability, contributing to agricultural productivity and sustainability.",BOTH
Raw Material Sourcing,"The process of identifying, procuring, and managing the supply of raw materials needed for production or research",BOTH
AI-Driven Antibody Design,"The use of artificial intelligence and machine learning to predict and optimize antibody structures, improve binding affinity and specificity, and accelerate the development of therapeutic antibodies by analyzing vast datasets and modeling interactions.",PRECLINICAL
Hybridoma sequencing,"The sequencing of hybridoma cells, which are created by fusing antibody-producing B cells with myeloma cells, to determine the genetic sequences of the antibodies they produce",PRECLINICAL
Liquid Biopsy,,CLINICAL
Ribosome Profiling (Ribo-Seq),Genome-wide analysis of ribosome positions to study translation,PRECLINICAL
Bioprocess Development,Conducting studies to validate that the bioprocess consistently produces a product meeting its predetermined specifications and quality attributes.,BOTH
Semi-Solid Dosage Forms,"The production of semi-solid formulations such as creams and ointments, intended for topical application to deliver drugs effectively to the skin or mucous membranes.",BOTH
Inhalation Products,"The development of drug products designed for inhalation, such as metered-dose inhalers (MDIs) or dry powder inhalers (DPIs), to treat respiratory conditions directly at the site of action in the lungs.",BOTH
Large Molecule Analysis,"Analyzing proteins, peptides, and antibodies using techniques like ELISA, immunoassays, and mass spectrometry",BOTH
Digital Pathology,Digital scanning of whole slide images of tissue sections for remote and quantitative analysis,BOTH
Nanomaterials Applications,"Studies on the application of nanomaterials in drug delivery, imaging, and sensors",BOTH
FFPE Sample Isolation,Extraction of nucleic acids from formalin-fixed paraffin-embedded blocks,BOTH
In Vitro Fertilization,"A reproductive technology involving the laboratory-based fertilization of eggs and sperm, followed by implantation of the embryo into the uterus to assist with conception.",CLINICAL
Custom Vector and Plasmid Construction,"Design and assembly of custom vectors for gene expression, cloning, and other applications",PRECLINICAL
Human Pathogens Diagnostic,,CLINICAL
DNA Sequencing and Genotyping,"Next-Generation Sequencing (NGS) for whole-genome, exome, and targeted sequencing, Sanger sequencing, nanopore",BOTH
Biodiversity Studies,Studies on the impact of human activities on biodiversity,BOTH
Pore Volume and Size Distribution,,BOTH
Forensic Lab Material and Component Testing,,BOTH
Biologics Bioanalytical Services,Laboratory services for analyzing biological samples.,BOTH
Phylogenetic Studies,Phylogenetic studies involve analyzing the evolutionary relationships among species or genes based on genetic data.,PRECLINICAL
ATAC-Seq Chromatin Accessibility Studies,Analyzing chromatin accessibility and gene regulation using Assay for Transposase-Accessible Chromatin using sequencing.,PRECLINICAL
Neurological Biomarker Research,Identification and validation of biomarkers for diagnosis and progression of neurological diseases,PRECLINICAL
Inductively Coupled Plasma (ICP),,PRECLINICAL
Multi-Angle Light Scattering (MALS),,PRECLINICAL
Insect Cell Culture and Bioprocessing,,PRECLINICAL
Immuno-Oncology Models,,PRECLINICAL
First-in-Human (FIH) PK/PD Studies,"Initial human studies to evaluate safety, tolerability, PK, and PD of a drug",CLINICAL
Genetic Testing,,CLINICAL
Whole Exome Sequencing (WES),,CLINICAL
SILAC (Stable Isotope Labeling by Amino acids in Cell Culture),Performing comparative quantitation,PRECLINICAL
Condensation,,PRECLINICAL
Hofmann Rearrangement,,PRECLINICAL
Biologics Formulation Development,"Stabilizing the final product in a suitable formulation that ensures its stability, efficacy, and safety during storage and use.",BOTH
Expression Pathway Analysis,The study of gene expression and biological pathways to understand the functional relationships and regulatory mechanisms in cells or organisms.,PRECLINICAL
Metabolite Profiling Data by Mass Spectrometry,"Utilizing mass spectrometry to analyze and quantify metabolites in a sample, providing insights into metabolic changes.",PRECLINICAL
In Vivo Autoimmunity Models,Animal models for acute and chronic inflammation studies,PRECLINICAL
Fungal Identification,"Identification and characterization of fungi using traditional culture techniques and modern molecular methods,  including ITS sequencing",PRECLINICAL
Ocular Disease Models,Services for developing and testing treatments for diseases of the eye,PRECLINICAL
Toxicology Screening,Early-stage toxicological evaluations to identify and mitigate safety risks,PRECLINICAL
Drug Design,Rational design of new drug candidates using structure-activity relationships (SAR) and structure-based drug design (SBDD),PRECLINICAL
Product Formulation and Development,"Design and development of nutraceutical formulations, including vitamins, minerals, herbs, and other dietary supplements",CLINICAL
Preclinical PK/PD Modeling,Use of animal models to predict human pharmacokinetics and pharmacodynamics,PRECLINICAL
Central Laboratory Services,Providing standardized laboratory testing for clinical trial samples on a global scale.,CLINICAL
Clinical Monitoring,"On-site and remote monitoring to ensure the conduct of the trial is in compliance with the protocol, standard operating procedures, and regulatory requirements.",CLINICAL
Genome Engineering,Genetic modification of organisms for research or biotechnological applications,PRECLINICAL
COVID-19 Testing,"Diagnostic assays to detect the presence of SARS-CoV-2, the virus causing COVID-19, using methods such as PCR, antigen tests, or serological assays.",CLINICAL
Antimicrobial/Preservative Effectiveness Testing,"Evaluation of the effectiveness of antimicrobial agents or preservatives in preventing microbial growth in products, ensuring their safety and longevity.",BOTH
Microbiological Testing,"The assessment of products and environments for microbial contamination, including the detection and quantification of bacteria, fungi, and other microorganisms to ensure product safety and compliance.",CLINICAL
Hydrolysis,,PRECLINICAL
Methylation,,PRECLINICAL
Bromination,,PRECLINICAL
Nitration,,PRECLINICAL
Cyanation,,PRECLINICAL
Diazotization Reaction,,PRECLINICAL
Pyrazines and Pyridines Synthesis,,PRECLINICAL
Insulin Bioidentity and Biopotency Test,,CLINICAL
Glucagon Bioidentity Test,,CLINICAL
In Silico Predictive Toxicology,,BOTH
Flow Cytometer,,PRECLINICAL
Imaging Mass Spectrometry (IMS),,PRECLINICAL
Systematic Evolution of Ligands by EXponential Enrichment (SELEX),,PRECLINICAL
Capillary Electrophoresis Analysis (CE Purity),,PRECLINICAL
Inductively Coupled Plasma–Mass Spectrometry (ICP–MS),,PRECLINICAL
Veterinary Diagnostic Testing,,BOTH
Gamma Sterilization,"The use of gamma radiation to sterilize medical devices, pharmaceuticals, or other products, providing an effective method for ensuring sterility and safety.",BOTH
Ethylene Oxide (EO) Residue Testing,The analysis of residual ethylene oxide (EO) levels on sterilized products to ensure that they are within acceptable limits and do not pose a risk to health.,BOTH
De Novo Protein Sequencing,Determination of an unknown protein's amino acid sequence without prior knowledge of the DNA sequence,PRECLINICAL
Peptide Library Synthesis,Synthesis of diverse collections of peptides with systematic variations,PRECLINICAL
Solid-Phase Peptide Synthesis,"A method where the peptide chain is assembled on a solid support, allowing for easy separation and purification of the peptide.",PRECLINICAL
Bone Marrow Toxicity and Stem Cell Hematotoxicity,,PRECLINICAL
Phototoxicity Test,,PRECLINICAL
Dermal Toxicity Test,,PRECLINICAL
Skin Sensitisation,,PRECLINICAL
X-ray Computed Tomography (CT),,PRECLINICAL
Liquid Chromatography-Mass Spectrometry (LCMS),,PRECLINICAL
Tissue Phenomics,,BOTH
Slide Reading and Image Analysis,,BOTH
Gas Chromatography Mass Spectrometry (GCMS),,PRECLINICAL
Thermal Gravimetric Analysis (TGA),,PRECLINICAL
Stereology,,PRECLINICAL
Fibrosis Models,,PRECLINICAL
Glycobiology Disease Model,,PRECLINICAL
Xenopus Oocyte,,PRECLINICAL
Inhalation Testing,,PRECLINICAL
Amyotrophic Lateral Sclerosis (ALS),,PRECLINICAL
Cell and GeneTherapies,,BOTH
Internal Medicine,,CLINICAL
Infectious Disease Clinical Testings,,CLINICAL
Cryogenic Freezing and Chilling,,BOTH
Neuroprotection,Studies on neuroprotective agents and oxidative stress markers,BOTH
Gene Synthesis,Synthesis of longer DNA sequences,PRECLINICAL
Genotoxicity Testing,"Assessing potential for DNA damage and mutagenic effects (Ames test, micronucleus assay, comet assay, and chromosomal aberration tests)",PRECLINICAL
Xenograft Models,,PRECLINICAL
Flow Cytometry Data Analysis,,BOTH
RNA Extraction,"Isolating RNA from biological samples, ensuring the purity and integrity of the RNA for subsequent applications such as reverse transcription, quantitative PCR, and RNA sequencing.",BOTH
Lead Formulation Studies,"Studies of suitable formulations for oral, topical, or parenteral administration",PRECLINICAL
Bacterial Genome Sequencing,Comprehensive sequencing of bacterial genomes,BOTH
Genito-urinary pathology,"The study and diagnosis of diseases affecting the genital and urinary systems, involving the analysis of tissue samples and biopsies to identify conditions such as infections, cancers, and structural abnormalities.",CLINICAL
Tissue Grossing and Cassetting,"The process of examining, measuring, and cutting tissue specimens to prepare them for histological processing, including placing the tissue samples into cassettes for further analysis and diagnosis.",BOTH
Sterility Testing,"A set of procedures used to detect the presence of microorganisms in pharmaceutical products, medical devices, or other sterile materials, ensuring that the products meet required sterility standards and are safe for use.",CLINICAL
Pattern Recognition Receptor Analysis,"This refers to examining receptors in the immune system that identify molecular patterns typical of pathogens, thus initiating an immune response.",BOTH
Microbial Testing,,BOTH
Radiation Testing and Analysis,,BOTH
Gene Expression Measurements,"Utilizing technologies such as qPCR, RNA-seq, ddPCR, and microarrays to quantify and analyze gene expression levels for research and clinical studies.",BOTH
Protein Characterization,Mass spectrometry; circular dichroism (CD) spectroscopy; dynamic light scattering (DLS) and Size Exclusion Chromatography-Multi-Angle Light Scattering (SEC-MALS),BOTH
Medicinal Chemistry,"Structural modification of lead compounds to improve potency, selectivity, and drug-like properties",PRECLINICAL
Epigenomics Data Analysis,"Analyzing data related to the epigenome, which encompasses all the chemical modifications to the DNA and histones that regulate gene expression.",PRECLINICAL
Animal Models for Acute and Chronic Pain,"Experimental animal models designed to mimic conditions of acute and chronic pain, used to study pain mechanisms, evaluate analgesic efficacy, and develop new pain management therapies.",PRECLINICAL
In Vitro Permeability Assays,"Measuring the ability of drugs to pass through biological membranes (e.g., Caco-2 cell assay)",PRECLINICAL
Clinical Trial Modeling of Therapeutics,,CLINICAL
Extraction and Purification of Natural Compounds,"Development of methods for extracting bioactive compounds from natural sources, including purification and concentration",PRECLINICAL
Antibody Fragmentation,"The process of breaking down antibodies into smaller fragments, such as Fab or F(ab')₂ fragments, to enhance their therapeutic properties, improve tissue penetration, or facilitate targeted delivery in various research and clinical applications.",PRECLINICAL
Unnatural Amino Acids Synthesis,,PRECLINICAL
Chiral Synthesis,"Specializing in the synthesis of chiral molecules, which are important in many pharmaceuticals",PRECLINICAL
Immunohistochemistry (IHC),Detection and localization of specific antigens in tissue sections using antibodies,BOTH
Phosphospecific antibodies,"Antibodies designed to specifically recognize and bind to phosphorylated forms of proteins, enabling the study of phosphorylation events and signaling pathways in various biological processes and disease states.",PRECLINICAL
Nucleotide Chemistry,Synthesis and modification of nucleotides and nucleotide analogs for therapeutic applications,PRECLINICAL
Climate Change Studies,"Research on the effects of climate change on ecosystems, species, and environmental processes",BOTH
Epigenetics Studies,Analysis of DNA methylation and histone modifications; chromatin immunoprecipitation (ChIP) assays,BOTH
Nanomaterials Development,"Synthesis and characterization of nanomaterials like nanoparticles, nanocomposites, and nanocoatings",BOTH
Metagenomics Sequencing,"Identification, sequencing, and analysis of microbial communities from environmental or clinical samples",PRECLINICAL
Protein Cryo-Electron Microscopy (Cryo-EM),Structural analysis of large protein complexes,PRECLINICAL
NMR-Based Metabolomics,"Use of Nuclear Magnetic Resonance for metabolite profiling, offering detailed structural information",PRECLINICAL
X-ray Crystallography,"Determination of the atomic structure of crystalline molecules for in-depth structural analysis of proteins, nucleic acids, and other moleclar complexes",PRECLINICAL
Genomic Variant Calling,"Process of identifying variations in the genetic sequence from genomic data, such as DNA sequencing.",PRECLINICAL
Lead Generation,Generation and optimization of lead compounds with desired biological activity,PRECLINICAL
Excretion Studies,Determining the routes and rates of drug elimination from the body,PRECLINICAL
NIPT (Non-Invasive Prenatal Testing),"A prenatal screening method that analyzes fetal DNA in the mother's blood to assess the risk of chromosomal abnormalities, such as Down syndrome, without invasive procedures.",CLINICAL
Vaccine Development and Testing,Preclinical development and testing of novel vaccines,BOTH
Mechanical Engineering,,BOTH
Drug-Drug Interaction Studies,Evaluation of the impact of co-administered drugs on ADME processes,PRECLINICAL
X-Ray Fluorescence (XRF),,PRECLINICAL
Proteome Profiling,Comparing protein expression across samples,PRECLINICAL
Post-Market Medical Device Surveillance,For post-approval continuous monitoring the safety and performance,CLINICAL
Risk Assessment and Data Analysis,Interpretation of toxicological data and risk assessment for human health,BOTH
Compartmental Modeling,A mathematical method used to model the distribution and elimination of a drug in the body using mathematical compartments,CLINICAL
Biologics Purification Process Development,Designing methods for separating the biologic product from cellular and media components,BOTH
Nutritional Content Analysis,"The assessment of food products to determine their nutritional composition, including the levels of vitamins, minerals, proteins, fats, and carbohydrates, to verify label accuracy and support dietary recommendations.",BOTH
Animal Feed Analysis,"The evaluation of animal feed for its nutritional content, quality, and safety, ensuring that it meets the dietary needs of livestock and complies with regulatory standards.",BOTH
Bioavailability Profiling and Enhancement,"Formulation Strategies for Improved Absorption: Techniques such as salt formation, complexation, or prodrug approaches to enhance drug absorption",BOTH
Stability Testing and Shelf-Life Studies,Assessing the stability of drug products under various conditions to ensure their quality and safety,BOTH
Nanoparticle Formulation,"The design and development of nanoparticles for use in drug delivery, imaging, or diagnostic applications, focusing on optimizing their size, surface properties, and functionality.",BOTH
Injectable Products,"The manufacturing of injectable drug products, including those packaged in vials or pre-filled syringes, designed for precise dosing and safe administration.",BOTH
Transdermal Patches,"The design and production of adhesive patches that deliver medication through the skin over a specified period, providing a controlled and sustained release of the drug.",BOTH
Air Quality Studies,"Monitoring and analysis of air pollutants, including particulate matter, volatile organic compounds (VOCs), and greenhouse gases",BOTH
Acid Cleaning,"The use of acidic solutions to remove inorganic contaminants, such as mineral deposits or rust, from equipment and surfaces to maintain cleanliness and prevent contamination.",BOTH
Influenza Testing,,CLINICAL
Quality Audits and Inspections,"Systematic evaluations of manufacturing processes, facilities, and quality systems to ensure compliance with industry standards and regulatory requirements, identifying areas for improvement and ensuring overall product quality.",BOTH
Cytotoxicity Assays,"Cytotoxicity assays are used to measure the ability of a substance to kill or inhibit the growth of cells, commonly used in toxicity testing and drug development.",BOTH
Density Measurement,,BOTH
Chemisorption Testing,,BOTH
"Particle Size, Shape, Count, and Stability",,BOTH
Conservation Studies,Research on the conservation of species and habitats,BOTH
Dermatopathology,Microscopic examination of skin biopsies,BOTH
Stem Cell Research,Culturing and differentiation of embryonic and adult stem cells; induced Pluripotent Stem Cell (iPSC) technology,PRECLINICAL
Protein-Protein and Protein-Ligand Interaction Studies,Surface Plasmon Resonance (SPR) and Isothermal Titration Calorimetry (ITC); co-immunoprecipitation and pull-down assays; Fluorescence Resonance Energy Transfer (FRET) and Bioluminescence Resonance Energy Transfer (BRET) assays,PRECLINICAL
Large-Scale Chemical Synthesis,Synthesizing chemicals and scaling up production for larger studies or preclinical testing.,PRECLINICAL
Brunauer-Emmett-Teller (BET),,PRECLINICAL
Mass Cytometry (CyTOF),,PRECLINICAL
Endocrinology Models,,PRECLINICAL
Biofilm Studies,"Evaluation of biofilm formation and testing of anti-biofilm agents; studies on biofilm physiology, genetics, and resistance mechanisms",PRECLINICAL
Validation of Cleaning Processes,"Quality control testing assessing the microbial contamination of pharmaceutical products, medical devices, and other sterile environments",BOTH
Colitis Models,,PRECLINICAL
Dermatitis Models,,PRECLINICAL
Cancer Models,,PRECLINICAL
Drug Synthesis Scale-Up,Scale-up synthesis for larger quantity production for advanced testing,PRECLINICAL
Structure-Activity Relationship (SAR) Analysis,Systematic modification of chemical structures to study the effects on biological activity,PRECLINICAL
Clinical Trial Project Management,"Coordination and oversight of all aspects of the clinical trial, ensuring milestones are met within timelines and budgets.",CLINICAL
Tumor Genotyping,,CLINICAL
Sample Identification/Fingerprinting,Techniques used to verify the identity and purity of biological samples through unique genetic or molecular markers,BOTH
Cytokine Quantification and Profiling,Cytokine quantification and profiling involve measuring and analyzing the levels of various cytokines in a sample.,BOTH
Biologics Scale-Up Strategies,Developing strategies to increase production scale from laboratory to industrial scale while maintaining product quality.,BOTH
Protein Separation and Characterization,"Chromatography (e.g., HPLC) for protein purification and analysis",PRECLINICAL
Biomolecular Modeling and Simulation,"Computational modeling and molecular dynamics simulations for structure prediction and functional analysis, and  in silico docking studies for drug discovery",PRECLINICAL
Custom Chemical Synthesis,Custom synthesis refers to the specialized creation of unique chemical compounds on demand for specific research or industrial purposes.,PRECLINICAL
X-ray Powder Diffraction (XRPD),For phase identification of a crystalline material,PRECLINICAL
Induced Disease Models,Animals in which disease is induced artificially to study its progression and treatment.,PRECLINICAL
Lead Bioavailability Studies,Improving the solubility and stability of lead compounds,PRECLINICAL
Chemical Library Development,Creation of diverse compound libraries for screening purposes,PRECLINICAL
Pharmacokinetic (PK) Simulation,Simulation studies for dose optimization and to minimize potential risks,PRECLINICAL
Bioequivalence Studies,"Assessment of therapeutic equivalance of drug products, particularly in the development of generic drugs",CLINICAL
Clinical Trials Management,"Comprehensive management of Phase I-IV clinical trials, including trial design, planning, execution, monitoring, and close-out.",CLINICAL
Biostatistics and Statistical Programming for Clinical Trials,"Statistical analysis planning, execution, and reporting of clinical trial data, including the use of advanced statistical software.",CLINICAL
Regulatory and Compliance Method Development,"The creation of analytical methods that meet regulatory requirements for drug development and manufacturing, ensuring compliance with industry standards and guidelines.",CLINICAL
Environmental Monitoring of Cleanrooms,"The continuous or periodic assessment of cleanroom environments to detect contaminants, such as particles or microorganisms, ensuring that they meet cleanliness and safety standards.",BOTH
Regulatory Compliance and Audit Support,"Assistance in navigating regulatory requirements and preparing for audits by regulatory agencies, ensuring that all processes and documentation meet legal and industry standards",BOTH
Rodent Preservation,"The freezing and long-term storage of rodent models, including genetically modified strains.",PRECLINICAL
In-Process and Release Testing,Testing conducted during and after the manufacturing process to ensure that products meet predefined quality standards before they are released for distribution.,CLINICAL
AI-Driven Drug Design,,PRECLINICAL
In Vitro High-Throughput Screening (HTS),Using automated technologies to rapidly test thousands to millions of compounds for activity against a target.,PRECLINICAL
Market Access & Real-World Evidence,,CLINICAL
Infectious Disease Models,"Research into pharmacological strategies for the treatment and prevention of infections caused by various pathogens, including bacteria, viruses, fungi, and parasites.",PRECLINICAL
Mitochondrial Function Studies,,BOTH
Small Molecule Process Optimization,"The refinement and enhancement of chemical synthesis processes for small molecule APIs to improve yield, purity, and cost-effectiveness while ensuring regulatory compliance.",BOTH
