name,definition,clinical_stage
Electrophysiology,"Patch-clamp, multi-electrode array (MEA), and EEG studies for neuronal activity analysis",PRECLINICAL
Neurotoxicology for Neuroscience Studies,Assessment of neurotoxic effects of compounds and environmental factors,PRECLINICAL
Scanning Electron Microscopy (SEM),"For producing detailed, magnified images to determine composition and physical features",PRECLINICAL
Bacterial Fermentation and Bioprocessing,Development and validation of bacterial fermentation processes for the production of bioproducts,PRECLINICAL
Urogenital Disease Models,"Research focused on pharmacological interventions and therapeutic approaches for diseases affecting the urogenital system, including urinary tract infections and reproductive disorders.",PRECLINICAL
Chemical Optimization,Optimization of synthetic routes for efficient production of lead compounds,PRECLINICAL
Large-Scale API Synthesis,Synthesizing chemicals and scaling up production for larger studies or preclinical testing.,PRECLINICAL
Engineered Fc Domains,,PRECLINICAL
Radiochemistry,"A crucial part of radiopharmaceutical development, involving the chemical processes to incorporate radioisotopes into pharmaceutical compounds.",PRECLINICAL
Anti-Idiotype Antibody Development,,PRECLINICAL
Mass Spectrometer Equipment Manufacturing,,BOTH
Skin Microbiome Analysis,Examination and characterization of the microbial communities residing on the skin,BOTH
Bacteriophages Development and Manufacturing,,BOTH
Ophthalmic Products,,CLINICAL
Residual Solvents Testing,,CLINICAL
Human Plasma-Derived Products Manufacturing,,CLINICAL
Food Allergen Testing,,BOTH
Particle Sizing,,BOTH
Inhalable Product Development and Testing,Determination of Aerodynamic Particle Size Distribution (APSD) and Delivered Dose (DD) for Dry Powder Inhalers (DPI) and Metered Dose Inhalers (MDI). Inhalation toxocology,BOTH
Granule Products,,BOTH
Sprays Products,,BOTH
Reverse Engineering,,BOTH
Patches Products,,BOTH
Heterocyclic Chemistry,,PRECLINICAL
Metabolites Synthesis,,PRECLINICAL
Nasal Dosage Products,,BOTH
Parenteral Dosage Products,,BOTH
Custom Purification and Separation,,BOTH
Reference Standard Synthesis,"Production of high-purity chemical standards used as benchmarks in analytical testing, ensuring the accuracy, reliability, and consistency of experimental results and quality control processes.",PRECLINICAL
Organoboronic Acids and Derivatives,,PRECLINICAL
Combinatorial Chemistry,Creation of large libraries of compounds for high-throughput screening,PRECLINICAL
Petrochemicals Synthesis,,BOTH
Glucuronides,,BOTH
Mammalian Cell Culture,,PRECLINICAL
Cell Proliferation Assay,,PRECLINICAL
Cell Migration and Invasion Assay,,PRECLINICAL
Extracellular Vesicle (EV) Transcriptomics,,PRECLINICAL
Glycosylation Analysis,,PRECLINICAL
UTI (Urinary Tract Infection) Screening,"Diagnostic tests to detect bacterial infections in the urinary tract, often using urine culture or rapid test methods to identify pathogens and guide treatment.",CLINICAL
Viral Load Testing,"Measurement of the amount of viral RNA or DNA in a patient's sample, used to monitor the progression of viral infections and the effectiveness of antiviral treatments.",CLINICAL
Neurodevelopmental Studies,Research on the development of the nervous system and neurodevelopmental disorders,PRECLINICAL
ADMET Optimization,"Optimization of absorption, distribution, metabolism, excretion, and toxicity properties of drug candidates",PRECLINICAL
Endotoxin and Pyrogen Testing,"Methods to detect endotoxins and pyrogens in pharmaceuticals and biologics, ensuring products are free from fever-causing contaminants and meet safety standards.",CLINICAL
Documentation and Batch Record Review,The examination of production documentation and batch records to verify that manufacturing processes are properly documented and that products are manufactured in accordance with established procedures and regulatory requirements.,BOTH
Training and Consultancy,,PRECLINICAL
Recombinant Antibody Production,,PRECLINICAL
Human Leukocyte Antigen (HLA) Genotyping,,CLINICAL
Tablet Compression,,CLINICAL
"Inventory Storage, Management, and Distribution",,CLINICAL
Behavioral Animal Models,"For studying the effects of drugs on animal behavior, often in the context of neurological or psychiatric conditions.",PRECLINICAL
Green Chemistry,Development of environmentally friendly synthesis routes,BOTH
Amplicon Sequencing,"A targeted sequencing method that amplifies specific regions of DNA through PCR, allowing for detailed analysis of genetic variations and mutations within those regions for research and clinical applications.",BOTH
Life Science Products Manufacturing,,BOTH
Industrial Machinery Manufacturing,,BOTH
mRNA Products Manufacturing,,BOTH
Plant Growth Media and Reagents,,BOTH
Multiplexed Tissue Analysis,,BOTH
Cytokine Release Assays,Cytokine release assays measure the amount of cytokines released by cells in response to a stimulus or treatment.,BOTH
Stable Cell Line Development and Characterization,"Creation of stable cell lines for research and bioproduction and characterization for phenotype, genotype, and functional properties.",BOTH
Molecular Pathology,"PCR and other molecular techniques for detecting genetic mutations, translocations, and expression levels",BOTH
Site-Directed Mutagenesis,"Making specific and intentional changes to the DNA sequence of a gene, allowing researchers to study the effects of these mutations on protein function and gene expression.",PRECLINICAL
Long Read Sequencing/Single Molecule Sequencing (SMS),"Advanced sequencing technologies that read long stretches of DNA or RNA molecules in a single pass, offering improved accuracy in detecting structural variants, repetitive regions, and complex genomic features.",PRECLINICAL
Hydrogen-Deuterium Exchange (HDX) Mass Spectrometry,Studying protein dynamics and interactions,PRECLINICAL
Optogenetics,"A technique that uses light to control cells within living tissue that have been genetically modified to express light-sensitive ion channels, enabling precise manipulation of neuronal activity for studying brain function and behavior.",PRECLINICAL
Drug Neurotoxicology Analysis,Evaluations of adverse effects of chemical and biological agents on the nervous system,PRECLINICAL
Chemoinformatics,"Use of in silico methods for compound screening, modeling, and prediction of ADMET properties",PRECLINICAL
Toxicology Animal Models,Acute and chronic toxicity studies in animals to assess the safety of potential pharmaceuticals,BOTH
Dispensing,,CLINICAL
Gastrointestinal Disease Models,"Research into drug development, mechanisms, and treatment strategies for diseases affecting the gastrointestinal system, such as inflammatory bowel disease and gastrointestinal cancers.",PRECLINICAL
Rodent Models,The most commonly used animals for studying disease and testing drugs.,PRECLINICAL
Tissue Engineering,"Developmenet of biological substitutes that restore, maintain, or improve tissue function",BOTH
Analysis of Cytokine Networks,Analysis of cytokine networks refers to studying the interactions and regulatory mechanisms among different cytokines in a system.,BOTH
Hit Identification,Identification of active compounds from high-throughput screening (HTS) campaigns,PRECLINICAL
Genetic and Genomic Biomarkers,"Analysis of genetic variants, gene expression patterns, and epigenetic modifications as biomarkers",BOTH
Greenhouse Gas Assessments,Comprehensive evaluations of the sources and amounts of greenhouse gas emissions associated with a specific entity or activity,BOTH
Oncology and Cancer Biology Cell Line Development,"Cancer cell line development and maintenance; assays for studying cancer cell proliferation, survival, metastasis, and drug resistance",PRECLINICAL
Gene Editing of Immune Cells,Techniques like CRISPR/Cas9 for modifying immune cells,PRECLINICAL
"Animal Models for Depression, Anxiety, Schizophrenia","Experimental animal models used to study the underlying mechanisms, behavioral manifestations, and potential treatments for mental health disorders such as depression, anxiety, and schizophrenia",PRECLINICAL
Dynamic Light Scattering (DLS),"A technique used to measure the size distribution and stability of particles in a solution, such as proteins, nanoparticles, and polymers, by analyzing the scattering of light caused by their Brownian motion.",PRECLINICAL
Thin layer chromatography (TLC),"Analytical technique used to separate and identify compounds in a mixture, involving the movement of a solvent across a thin layer of adsorbent material, such as silica gel, on a glass or plastic plate.",PRECLINICAL
"Potency Assays (e.g., Cell-Based Assays)","Tests designed to measure the biological activity and effectiveness of therapeutics, often using living cells to evaluate the potency and functionality of drugs or vaccines.",BOTH
Polyclonal Antibody Production,Generation of antibodies targeting multiple epitopes on an antigen,PRECLINICAL
In Situ Hybridization (ISH),Detection and localization of specific nucleic acid sequences directly within tissue sections,BOTH
Protein Detection,"E.g, Western blot, ELISA, Flow Cytometry",BOTH
Fuel Analysis,,BOTH
Custom API Synthesis,"The tailored production of active pharmaceutical ingredients based on specific client requirements, including unique chemical structures, quantities, and quality standards.",BOTH
Aseptic Processing,The production method that maintains sterile conditions throughout the manufacturing process to ensure that the final drug product is free from microbial contamination.,BOTH
Plastic Manufacturing,,BOTH
Neurotoxicity,,PRECLINICAL
Cell Culture,Primary cell culture and cell line development for various cell types; 3D cell culture systems,PRECLINICAL
Pharmacometabolomics,Analysis of metabolite profiles in response to drug treatment,BOTH
Transcriptomics Data Analysis,Analysis of RNA-Seq data for differential gene expression,PRECLINICAL
Oncology,,CLINICAL
Behavioral Testing,"Studies for cognitive function, executive function, mood assessment",PRECLINICAL
Histopathology,Microscopic examination of tissue samples to analyze structure and identify abnormalities,CLINICAL
Clinical Data Management,"Collection, cleaning, and management of clinical trial data, ensuring accuracy and integrity using electronic data capture (EDC) systems.",CLINICAL
Pathway Engineering,"Design and optimization of metabolic pathways for the production of pharmaceuticals, biofuels, and industrial chemicals",PRECLINICAL
Antibody Humanization,"The modification of non-human antibodies to make them more similar to human antibodies, reducing the risk of immune reactions and improving their efficacy and safety for therapeutic use in humans.",PRECLINICAL
In Vivo Gene Therapy Studies,Evaluating the efficacy and safety of the gene therapy candidate in animal models,PRECLINICAL
In Vitro Preclinical Studies for Nutraceuticals,In vitro studies for toxicology assessments and mechanism of action of nutraceutical ingredients,PRECLINICAL
T Cell Receptor (TCR) Profiling,"Analyzing the diversity and specificity of T cell receptors within a sample, providing insights into the immune repertoire, immune response, and potential targets for immunotherapy.",BOTH
Toxicogenomics,Study of how genetic variations influence individual responses to toxicants,PRECLINICAL
Novel Compound Synthesis,"Custom synthesis of small molecules, including complex organic compounds",PRECLINICAL
Flow Cytometry of Immune Cells,For immune cell phenotyping and sorting,BOTH
Plasmid DNA Manufacturing,Production of high-quality plasmid DNA encoding the therapeutic gene for vector production,BOTH
Single-Cell Sequencing,Sequencing and analysis of individual cells for high-resolution genomic insights,PRECLINICAL
Sequence-based genotyping (SBG),,PRECLINICAL
Restriction site-associated DNA sequencing (RAD-Seq),,PRECLINICAL
Functional Analysis and Characterization of Therapeutic Proteins,"Comprehensive assessment of therapeutic proteins' biological activity, stability, and physicochemical properties to ensure their efficacy, safety, and quality for clinical use.",BOTH
High Resolution Imaging,For obtaining high resolution and depth of field images of a sample surface,PRECLINICAL
Metabolomics Data Analysis,"Interpreting complex data from the study of metabolites, the small molecule chemicals in biological systems.",PRECLINICAL
Machine Learning and Predictive Modeling,Application of machine learning algorithms for pattern recognition and predictive modeling,PRECLINICAL
Drug Optimization,Optimization of pharmacokinetic and pharmacodynamic properties of drug candidates,PRECLINICAL
Clinical Supply Chain Management,"Management of the logistics related to the clinical trial supplies, including drug procurement, storage, and distribution.",CLINICAL
cDNA synthesis,"The process of synthesizing complementary DNA (cDNA) from an RNA template using reverse transcription, providing a stable and amplifiable copy of the RNA for various molecular biology applications such as cloning and gene expression analysis.",BOTH
Skin Toxicity,,PRECLINICAL
Intestinal Toxicity,,PRECLINICAL
Physiochemical Property Testing,"Including Thermal Gravimetric Analysis (TGA), Mercury Porosimetry (HgP), Surface Area & Porosity (BET), Melting Point (MP), Flash Point (FP), Coupon Corrosivity (CORR), Viscosity (VISC), Laser Light Scattering (LLS), Dynamic Vapor Sorption (DVS)",BOTH
Spatial Transcriptomics,"A technique that combines histology and RNA sequencing to map gene expression within the spatial context of tissue sections, providing insights into cellular functions and interactions in their native environment.",PRECLINICAL
Transcriptome Assembly,Transcriptome assembly involves piecing together sequences of RNA transcripts to study the full range of expressed genes in a cell or organism.,PRECLINICAL
Stroke and Cerebral Ischemia Animal Models,"Experimental animal models used to study the mechanisms, progression, and potential treatments for stroke and cerebral ischemia",PRECLINICAL
Precision-Cut Tissue Slices,Tissue slices maintained in a way that preserves their physiological function for studying drug metabolism and toxicity.,PRECLINICAL
API Scale-Up Synthesis,Process and technology transfer from lab scale to pilot and production scale,PRECLINICAL
Hereditary Cancer Screening,,CLINICAL
Clinical Packaging and Labeling,"The design, production, and labeling of packaging for clinical trial materials, ensuring that packaging meets regulatory requirements, maintains product integrity, and provides clear, accurate information for trial participants and staff.",CLINICAL
Genomic Data Analysis,"Analysis of data from whole-genome sequencing, exome sequencing, and targeted sequencing",PRECLINICAL
Immune Cell Isolation,"The process of separating specific immune cell types, such as peripheral blood mononuclear cells (PBMCs), T cells, B cells, and natural killer (NK) cells, from a heterogeneous cell population",BOTH
FFPE Block Embedding,"The technique of embedding formalin-fixed, paraffin-embedded (FFPE) tissue samples into paraffin blocks, which preserves the tissue architecture and allows for long-term storage and subsequent histological analysis.",BOTH
Nutraceutical Safety Testing,"The assessment of the safety and efficacy of nutraceuticals through rigorous testing protocols, including toxicity studies, quality control, and regulatory compliance",BOTH
Gene Therapy Vector Design and Development,"Selection of appropriate vector type (e.g., AAV, lentivirus) and engineering for optimal delivery and expression of the therapeutic gene",BOTH
Chemical Synthesis Scale-Up,"For research or industrial applications, from laboratory to pilot and production scale",PRECLINICAL
Near Infrared (NIR) and Ultraviolet / Visible (UV-VIS) Spectroscopy,"Analytical techniques that measure the absorption or reflectance of NIR and UV-VIS light by a sample, providing information on molecular composition, structure, and concentration.",PRECLINICAL
Gastro-intestinal pathology,"The study and diagnosis of diseases affecting the gastrointestinal tract, involving the examination of tissue samples, endoscopic biopsies, and surgical specimens to identify conditions such as inflammation, infections, cancer, and other digestive disorders.",CLINICAL
Oncology and Bone Model,,PRECLINICAL
Organ-on-a-Chip,"Microfluidic devices that simulate the activities, mechanics, and physiological response of entire organs and organ systems.",PRECLINICAL
Cardiovascular Models,,PRECLINICAL
Orthopaedics,,BOTH
Antibody Internalization Assays,Techniques used to evaluate the ability of antibodies to be internalized by target cells,PRECLINICAL
Antimicrobial Resistance Testing,Detrmination of the susceptibility or resistance of specifci bacteria or fungi to antibiotics,PRECLINICAL
Oligonucleotide Synthesis,Synthesis of DNA and RNA oligonucleotides for research and therapeutic applications,BOTH
Biocompatibility and Bioactivity Studies,Development and testing of materials for tissue scaffolds,BOTH
Chemokine Quantification and Profiling,Chemokine quantification and profiling are the measurement and analysis of various chemokines in a given biological sample.,BOTH
Protein Expression Analysis,Mass spectrometry and 2D-gel electrophoresis for protein identification and quantification,BOTH
Life Cycle Assessments (LCA),Assessing the environmental impact of products or processes over their entire life cycle,BOTH
Antibody Proteomics,Production and characterization of antibodies against specific proteins,PRECLINICAL
AI-Driven Drug Discovery,AI-driven drug discovery and precision medicine,PRECLINICAL
Regenerative Medicine (Neuroscience),Studies on stem cell therapy and neurogenesis,PRECLINICAL
Fluorescence Resonance Energy Transfer (FRET),For studying proximities and interactions of biomolecules,PRECLINICAL
Raman Spectroscopy,"Non-destructive, vibrational spectroscopy for molecular identification and structural analysis",PRECLINICAL
Non-Human Primate Models,Used in research where closer physiological similarities to humans are required.,PRECLINICAL
Lab Animal Diagnostics,,BOTH
In Vitro Efficacy of Leads,Biological assays to confirm and quantify the therapeutic effects of lead compounds in relevant disease models.,PRECLINICAL
Prodrug Design,"Design of prodrugs to improve solubility, bioavailability, or targeting properties of active pharmaceutical ingredients (APIs)",PRECLINICAL
Non-Compartmental Analysis (NCA),A mathematical method used to estimate basic PK parameters,CLINICAL
Clinical Trial Feasibility Studies,"Assessment of the feasibility of conducting a clinical trial, including site and investigator selection, patient population availability, and local regulations.",CLINICAL
DNA Assembly,Large scale DNA assembly for constructing synthetic genomes and complex genetic constructs,PRECLINICAL
Surface Plasmon Resonance (SPR),"Real-time monitoring of biomolecular interactions; kinetic analysis of binding affinities, rates, and specificities",PRECLINICAL
Pathway Analysis and Metabolic Network Reconstruction,Evaluating the interconnections and pathways among different metabolic and biological processes in an organism.,PRECLINICAL
Protein Isolation,"Chromatographic techniques (affinity, ion exchange, size exclusion) for protein purification; tag removal and protein refolding services",BOTH
Molecular Assay Development and Validation,"Developing and validating bioassays for drug screening, toxicity testing, molecular diagnostics, and specific research needs",BOTH
Advanced Cell-Imaging Techniques,"Live-cell imaging for studying dynamic cellular processes; fluorescence microscopy, confocal microscopy, and high-resolution imaging",PRECLINICAL
Protein X-ray Crystallography,Determining 3D structures of proteins,PRECLINICAL
Small-Angle X-ray Scattering (SAXS),"Studies of protein folding, unfolding, and complex formation",PRECLINICAL
Pharmacogenetics Analysis,"Pharmacogenetics analysis studies how genetic differences in individuals affect their response to drugs, aiming to personalize medicine.",CLINICAL
Pharmacovigilance and Safety Monitoring,"Ongoing monitoring and reporting of adverse events, side effects, and other safety data during the clinical trial.",CLINICAL
Alkylation,,PRECLINICAL
Mycology Services,"Antifungal susceptibility testing, fungal isolation, and identification of pathogenic and environmental fungi; antifungal susceptibility testing, fungal isolation, and identification",PRECLINICAL
Necropsy Services,"Comprehensive post-mortem examinations in animals, including tissue collection for further histological and molecular analyses",PRECLINICAL
Organotypic Cultures,Maintaining an organ or tissue in a culture medium to study its native properties and responses.,PRECLINICAL
Immunogenicity Assessment,"Testing the potential of a compound, especially biologics, to elicit an immune response.",CLINICAL
Gut Immunity Animal Models,"Animal models used to study the immune system of the gastrointestinal tract, focusing on how it responds to various stimuli, pathogens, and treatments.",PRECLINICAL
Isothermal Titration Calorimetry (ITC),Measurement of heat changes during molecular interactions,PRECLINICAL
Endotoxin Testing,"Quality control testing assessing the microbial contamination of pharmaceutical products, medical devices, and other sterile environments",BOTH
Drosophila Models,"The use of the fruit fly, Drosophila melanogaster, as a model organism in genetic and biomedical research, enabling the study of gene function, development, and disease mechanisms due to its genetic tractability and short life cycle.",PRECLINICAL
Dose-Response Assessment,Evaluation of quantitative relationship between the dose administered and the intensity of the PD effect,CLINICAL
Nutritional Analysis,"Comprehensive nutritional analysis to determine the content of vitamins, minerals, and other nutrients",CLINICAL
In Vivo Preclinical Studies for Nutraceuticals,Animal studies to evaluate the biological activity and safety of nutraceutical ingredients,PRECLINICAL
B Cell Immortalization,Immortalization of B cells producing desired antibodies using Epstein-Barr virus (EBV) or other techniques,PRECLINICAL
"ADMET (Absorption, Distribution, Metabolism, Excretion, and Toxicity) Profiling","Early evaluation of pharmacokinetic properties such as solubility, stability, permeability, metabolic stability, and toxicity in in vitro models",PRECLINICAL
Analytical Method Development and Validation for Nutraceuticals,"Development of analytical methods for identifying and quantifying nutraceutical compounds, and validating to meet regulatory standards",BOTH
Immune Checkpoint Studies,Evaluation of checkpoint inhibitors in cancer immunotherapy,BOTH
ELISA Assays,"ELISA assays are laboratory tests that use antibodies and color change to identify a substance, commonly used for detecting and quantifying proteins in samples.",BOTH
Specialty Stains for Histopathology,Specialized stains for specific tissues or biomarkers beyound H&E staining for detailed morphological and immunological analysis,BOTH
Central Nervous System (CNS),,CLINICAL
Epigenomics Sequencing/Bisulfite Sequencing (Melthy-Seq),"DNA methylation sequencing and histone modification profiling; chromatin accessibility assays (e.g., ATAC-seq) for understanding gene regulation",PRECLINICAL
Metabolite Biomarker Discovery,Identification and validation of metabolites as biomarkers,PRECLINICAL
Cell Biobanking,Preservation and storage of cell lines or primary cells for future research.,BOTH
Integration of Multi-Omics Data,"Combining and analyzing data from different 'omics' fields (like genomics, proteomics, metabolomics) to gain a comprehensive biological understanding.",PRECLINICAL
Protein Aggregation Assays,"Protein Aggregation Assays measure the formation of protein aggregates, a hallmark of many neurodegenerative diseases like Alzheimer's and Parkinson's.",PRECLINICAL
Rodent Models for Carcinogenicity Studies,For studying lifetime exposure and carcinogenic risk assessment,PRECLINICAL
Fourier Transform Infrared (FTIR) Spectroscopy,"For binding studies, protein secondary structure analysis, and biomolecule normalization",PRECLINICAL
C. elegans Models,"The use of the nematode Caenorhabditis elegans as a model organism in biological research, facilitating the study of genetics, development, and neurobiology due to its simple anatomy, well-mapped genome, and ease of genetic manipulation.",PRECLINICAL
Companion Diagnostics,Development of biomarker-based diagnostic tests that are paired with therapeutic drugs to determine their suitability for specific patients,CLINICAL
API Bioavailability Studies,Assessment of API availability at site of action to determine efficacy and safety profile,CLINICAL
Phase I / First-in-Human,,CLINICAL
Medical Writing,"Preparation of clinical documents such as protocols, investigator brochures, consent forms, study reports, and regulatory submission documents.",CLINICAL
Parkinson's Disease Models,,PRECLINICAL
Chronic Pain Models,,PRECLINICAL
Osteoporosis and Bone Models,,PRECLINICAL
Hepatology Models,,PRECLINICAL
Material Laser Processing and Die Cutting,,BOTH
Dermathology Models,,PRECLINICAL
Vetrinary Pathology,"The study and diagnosis of diseases in animals through the examination of tissue samples, organs, and bodily fluids",BOTH
Agrochemical Safety Testing,,PRECLINICAL
Viral Titer Testing,,BOTH
Virus-like Particle (VLP) Vector Production and Packaging,Development and purification of VLP (virus-like particles) vectors and packaging of cargo into VLPs,BOTH
Cannabis Testing,,BOTH
Manure and Compost Testing,,BOTH
Crop Testing,,BOTH
"Appliances, Electrical, and Electronics Manufacturing",,BOTH
In Vivo Cell Therapy Studies,,PRECLINICAL
