name,definition,clinical_stage
Pharmacokinetic (PK) Modeling,"Mathematical modeling of ADME data to predict drug behavior under various scenarios, such as different dosages, routes of administration, and in specific populations",PRECLINICAL
Clinical Trial Site Management and Coordination,"Managing relationships with clinical trial sites and investigators, including training, site initiation, and ongoing support.",CLINICAL
Nutraceutical Product Labeling,"Accurate and compliant product labeling, including nutritional facts and health claims",CLINICAL
Synthetic Gene Circuits,Design and construction of synthetic gene networks to program cellular behavior,PRECLINICAL
Wastewater Testing,,BOTH
Toxicologic Pathology,For assessing drug or chemical toxicity or safety,BOTH
Small Molecule Biocatalysis,"The use of biological catalysts, such as enzymes or cells, to facilitate and optimize the synthesis of small molecule APIs, offering environmentally friendly and efficient manufacturing methods.",BOTH
Cell Signaling Pathway Reporter Screening,,PRECLINICAL
Large Molecule (Biologics) Production,"The manufacturing of biologic drugs, such as proteins, monoclonal antibodies, and vaccines, using biological systems like cell cultures or microorganisms to produce complex therapeutic molecules.",BOTH
Small Molecule Analysis,"Quantifying small-molecule drugs, metabolites, and biomarkers in biological matrices like blood, plasma, and tissues",BOTH
Gene Editing and CRISPR Services,"CRISPR-Cas9 gene editing for targeted gene knockouts, knock-ins, and genome modifications",BOTH
Nucleic Acid Biomarker Discovery,Identification of DNA or RNA markers that indicate a particular disease state or therapeutic response,BOTH
De Novo DNA Sequencing,"The process of sequencing a novel genome from scratch without a reference sequence, allowing for the assembly and analysis of previously uncharacterized genomes",PRECLINICAL
Environmental Metabolomics,Analysis of the metabolic responses of organisms to environmental stressors and pollutants,PRECLINICAL
Animal Models for Neuroinflammatory Conditions,For studying conditions like multiple sclerosis and Parkinson’s disease,PRECLINICAL
In Vitro Models of Neurodevelopment,Studies using iPSC-derived neurons and organoids,PRECLINICAL
Developmental and Reproductive Toxicology (DART),"Examining effects on pregnancy, fetal development, and fertility",PRECLINICAL
Analytical Ultracentrifugation (AUC),"Analysis of size, shape, and interactions of macromolecules in solution",PRECLINICAL
Fungal Fermentation and Bioprocessing,Development and validation of fungal fermentation processes for the production of bioproducts,PRECLINICAL
Bioburden and Sterility Testing,"Quality control testing assessing the microbial contamination of pharmaceutical products, medical devices, and other sterile environments",BOTH
Pharmacokinetics and Pharmacodynamics (PK/PD) Modeling,"Optimization of drug properties for better absorption, distribution, metabolism, and excretion (ADME)",BOTH
Pharmacodynamic Biomarkers,Identification of biomarkers that indicate a response to therapeutic intervention.,CLINICAL
Alzheimer's Disease Models,,PRECLINICAL
DC Migration Assay,,PRECLINICAL
Neuromuscular Models,,PRECLINICAL
Biopesticidal Testing,,PRECLINICAL
Adenovirus Production and Packaging,,BOTH
Cell Therapy Bioanalytical Services,,BOTH
Fertilizer Testing,,BOTH
Oral Solid Dosage Forms,"The formulation and manufacturing of solid dosage forms, including tablets and capsules, designed for oral administration and optimized for stability, release, and patient compliance.",BOTH
Aptamer Design and Production,,BOTH
Medical Equipment Manufacturing,,BOTH
Inorganic and Organometallic Compounds Synthesis,,PRECLINICAL
Molecular Surface Engineering,,PRECLINICAL
Impurities Synthesis,,PRECLINICAL
Spatial Phenotyping,,BOTH
Viral Safety,,PRECLINICAL
Focused Ion Beam (FIB),,PRECLINICAL
Animal Model Breeding,"The controlled reproduction of laboratory animals to produce offspring with specific genetic traits, supporting research by providing consistent and genetically defined animal populations for experimental studies.",PRECLINICAL
Clinical Investigations for Medical Devices and Diagnostics,,CLINICAL
Animal Surgical Suites,"Specialized facilities equipped for performing surgical procedures on laboratory animals, ensuring sterile conditions and providing advanced surgical tools and anesthesia for precise and humane operations.",PRECLINICAL
Rabbit Models,Used for specific types of research where rodents are not suitable.,PRECLINICAL
Canine and Feline Models,Sometimes used in veterinary medicine research or for diseases shared with humans.,PRECLINICAL
Cell Culture Model Development,Using human or animal cells grown in a lab to study cellular processes and drug interactions,PRECLINICAL
Thermal Analysis,,BOTH
Bioinformatics Consulting,,BOTH
Autoimmune,,CLINICAL
Hematology,,CLINICAL
Antibody Characterization,"Analysis of properties of antibodies such as binding affinity, specificity, stability, isotype, modifications, functionality",PRECLINICAL
Antibody sequencing,"The process of determining the amino acid sequence of antibody chains, including both heavy and light chains, to understand their specificity, develop new therapeutics, and study immune responses.",PRECLINICAL
Protein Glycosylation Service,,BOTH
Polymer Coating,,BOTH
Electrospun Biomaterials Design and Development,,PRECLINICAL
Autoimmunity Models,,PRECLINICAL
"Mechanical Components, Optical Elements, Fibers, Semiconductors Manufacturing",,BOTH
Optical Measurements,,BOTH
"Cardiovascular, Renal and Metabolic (CVRM)",,CLINICAL
Internal medicine,,CLINICAL
Infectious Disease,,CLINICAL
Tuberculosis,,CLINICAL
Respiratory System,,CLINICAL
Psychiatry,,CLINICAL
Surgery,,CLINICAL
Phase II-III,,CLINICAL
Large-Scale Antibody Production,Scalable production of antibodies for preclinical and clinical studies using bioreactors and optimized cell culture protocols,PRECLINICAL
Hardness Testing,,BOTH
Softgel Technologies,"The development and production of soft gelatin capsules that encapsulate liquid or semi-solid ingredients, providing an alternative to traditional solid dosage forms with enhanced bioavailability and ease of ingestion.",BOTH
Autologous and allogeneic cell therapy development,"Development services for both autologous and allogeneic cell therapies, including cell sourcing, processing, expansion, and characterization, meeting regulatory standards to ensure therapeutic efficacy and safety.",BOTH
Bioanalytical Services,Development and validation of bioanalytical methods for drug and  quantification in biological matrices,BOTH
Patient Recruitment and Retention,"Strategies and services to enhance patient enrollment and retention in clinical trials, including patient outreach and engagement.",CLINICAL
Allergy Models,Research on hypersensitivity and allergic reactions,PRECLINICAL
Custom Media Manufacturing,,BOTH
Biomaterial Manufacturing,,BOTH
Homecare Product Manufacturing,,BOTH
Epitope Design,,PRECLINICAL
Distillation Services,,BOTH
Extracellular Vesicle (EV) Proteomics,,PRECLINICAL
Weld Testing,,BOTH
Lentivirus Vector Production and Packaging,Development and purification of lentiviral vectors and packaging of cargo into lentivirus,BOTH
Suspensions and Emulsion,,BOTH
Cell Line Authentification (STR),"Verification of cell line identity using Short Tandem Repeat (STR) profiling, confirming the genetic fingerprint of the cell line",BOTH
Mycoplasma Testing,"Detection of mycoplasma contamination in cell cultures, ensuring the integrity and reliability of biological research and biomanufacturing processes by preventing false results and compromised data.",BOTH
Photobiological Assessments,,PRECLINICAL
Pharmaceutical Manufacturing,,BOTH
Chemical Manufacturing,,BOTH
Biologics Manufacturing,,BOTH
Cosmetic Formulation,,BOTH
Cosmetic Testing,,BOTH
Lasers Imaging,,BOTH
Renal Toxicity,,PRECLINICAL
Spectroscopic Testing,"Including, X-Ray Photoelectron Spectroscopy (XPS, ESCA), Auger Electron Spectroscopy (AES), Time-of-Flight Secondary Ion Mass Spectrometry (Static) (TOF-SIMS)",BOTH
Extracellular Vesicles (EVs) Isolation and Purification,,BOTH
Extracellular Vesicles (EVs) Characterization,,BOTH
T Cell Specificity Assay,,BOTH
Macrophage Polarization Assay,,PRECLINICAL
Comparative Genomics,Comparative genomics is the study of comparing the genetic material of different species to understand their evolutionary relationships and functional biology.,PRECLINICAL
Cell Viability Assay,,PRECLINICAL
Cell Cycle Assay,,PRECLINICAL
Apoptosis Assay,,PRECLINICAL
Electrophoretic Mobility Shift Assay (EMSA),"Studying DNA-protein, RNA-protein, or protein-protein interactions for analysis of binding specificity and affinity",PRECLINICAL
Infectious Wound Screening,"Analysis of wound samples to identify infectious agents and assess the presence of pathogens, aiding in the diagnosis and treatment of infected wounds.",CLINICAL
Antibiotic Resistance Testing,"Tests to determine the resistance of bacteria to various antibiotics, helping to guide effective treatment strategies and combat antibiotic-resistant infections.",BOTH
Chemical Process Development,"Development and optimization of efficient, safe, and environmentally friendly chemical processes",PRECLINICAL
Population Pharmacokinetics,Analysis of PK data from different populations to understand variability in drug responses,CLINICAL
Life Sciences Consulting and Advisory Services,,BOTH
Mechanical Testing,,BOTH
SEM-EDS Analysis,,BOTH
Physico-chemical Property Testing,"Including Thermal Gravimetric Analysis (TGA), Mercury Porosimetry (HgP), Surface Area & Porosity (BET), Melting Point (MP), Flash Point (FP), Coupon Corrosivity (CORR), Viscosity (VISC), Laser Light Scattering (LLS), Dynamic Vapor Sorption (DVS)",BOTH
In Vitro Gene Therapy Studies,Evaluating the efficacy and safety of the gene therapy candidate in cells,PRECLINICAL
Women’s Health,,CLINICAL
Nanoparticle Toxicity Panel Testing,,PRECLINICAL
Bioanalytical Testing,Quantitative analysis of drugs and their metabolites in biological samples,BOTH
Frozen Sectioning,Rapid preparation of tissue sections for immediate diagnosis or analysis,CLINICAL
Zebrafish Models,Increasingly popular for genetic and developmental studies.,PRECLINICAL
Analytical Method Development and Method Transfer,"The creation and validation of analytical techniques for testing product quality and performance, and the transfer of these methods between laboratories or production sites to ensure consistency and reliability.",BOTH
Sterilization,"The process of eliminating all forms of microbial life from equipment, surfaces, or materials to ensure a sterile environment and prevent contamination.",BOTH
Bacterial Biobanking,"The preservation and storage of bacterial strains and cultures, providing a resource for studying microbial genetics, antibiotic resistance, and other bacterial behaviors.",PRECLINICAL
Retrovirus Vector Production and Packaging,Development and purification of retroviral vectors and packaging of cargo into retrovirus,BOTH
Wet Chemistry,"Content Uniformity (UV), pH, Viscosity, Specific gravity, Conductivity, Water (I), Karl Fisher Moisture (KF), Total Organic Carbon (TOC), Ion Selective Electrode Analysis (ISE), Total Carbon (TC)",PRECLINICAL
BSL-4 Laboratory Capabilities,"Facilities designed for the highest level of biological containment, enabling the safe study and handling of highly dangerous and exotic pathogens that pose a high risk of aerosol-transmitted infections and for which there are no available vaccines or treatments.",PRECLINICAL
Mass Spectrometry-Based Metabolomics,Use of LC-MS (Liquid Chromatography-Mass Spectrometry) and GC-MS (Gas Chromatography-Mass Spectrometry) for high-throughput metabolite profiling,PRECLINICAL
Microbial Limit Tests,"Quality control testing assessing the microbial contamination of pharmaceutical products, medical devices, and other sterile environments",PRECLINICAL
Ecotoxicology,"Testing the impact of chemicals on ecosysstems, wildlife, and various species, including fish, birds, and terrestrial animals",PRECLINICAL
Hit-to-Lead High-Throughput Screening (HTS),"Development of robust, scalable assays for efficient hit identification",PRECLINICAL
Regulatory Toxicology,"Design and conduct of studies to meet the requirements of regulatory agencies like FDA, EMA, and EPA",BOTH
Electron Crystallography,Analysis of two-dimensional crystals for membrane proteins and large complexes,PRECLINICAL
Exposomics,,PRECLINICAL
In Vivo Immune Tolerance,In vivo models to study mechanisms of immune tolerance,PRECLINICAL
Splicing Analysis,Splicing analysis examines the process by which introns are removed and exons are joined in RNA to understand how different mRNA variants are generated.,PRECLINICAL
Soil and Sediment Analysis,"Testing for contaminants like heavy metals, pesticides, and hydrocarbons in soil and sediment",BOTH
Bone and Soft Tissue Pathology,Specialized techniques for musculoskeletal tissues,BOTH
Affinity Proteomics,Affinity capture assays to isolate and study proteins or protein complexes,PRECLINICAL
Esterification,,PRECLINICAL
Halogenation (Fluorination),,PRECLINICAL
Hydrogenation,,PRECLINICAL
Acylation,,PRECLINICAL
Carboxylation,,PRECLINICAL
Oxidation,,PRECLINICAL
Cell Immortalization,,PRECLINICAL
Cell-Based Assays,"Development and validation of in vitro assays for drug screening and toxicity testing, apoptosis, proliferation, migration, invasion, and angiogenesis",PRECLINICAL
Protein Expression,"Expression of recombinant proteins in bacterial, yeast, insect, mammalian, or cell-free systems, including scale up",PRECLINICAL
Spatial Proteomics,,PRECLINICAL
Metabolic Pathway Analysis,Mapping of metabolomic data onto metabolic pathways to understand biological mechanisms,PRECLINICAL
Monoclonal Antibody Production,Generation of antibodies derived from a unique cell and targeting a single epitope on an antigen,PRECLINICAL
Botulinum NeuroToxin Test,,CLINICAL
X-ray Photoelectron Spectroscopy (XPS),,PRECLINICAL
X-ray Diffraction (XRD),,PRECLINICAL
Immunofluorescence (IF),For visualizing the location and distribution of specific proteins within tissue sections,PRECLINICAL
Peptide Chemistry,Synthesis and modification of peptides and peptide mimics for therapeutic applications,PRECLINICAL
Stem Cell Therapy Development,Development of stem cell therapies and protocols for clinical applications,BOTH
Elemental Analysis,Determining the elemental composition of materials for quality control and regulatory compliance,BOTH
Drug-Target Interaction Studies,Measuring the direct interaction between identified compounds and their target proteins,BOTH
Lipidomics,Specific focus on the analysis and characterization of the lipid components of cells and tissues,PRECLINICAL
Circular Dichroism (CD),Analysis of protein stability and folding,PRECLINICAL
Neuroimmunology,Research on the role of the immune system in neurological disorders,PRECLINICAL
Stem Cell Toxicity,,PRECLINICAL
Inhalation Toxicology,,PRECLINICAL
Local Tolerance,,PRECLINICAL
X-Ray Radiography (XRR),,PRECLINICAL
Metabolite-Trait Associations,Studying correlations between specific metabolites and phenotypic traits or disease states.,PRECLINICAL
Dermatological In Vitro Testing,,PRECLINICAL
Mechanical Product Design,,PRECLINICAL
Water Quality Testing,"Analysis of water samples for pollutants, microbial contamination, and chemical composition; assessing drinking water, wastewater, and surface water for environmental compliance",BOTH
Lipid Nanoparticle Formulation,"The creation of lipid-based nanoparticles for drug delivery systems, such as mRNA vaccines, emphasizing the development of stable, biocompatible, and effective carriers for encapsulating and delivering therapeutic agents.",BOTH
Labeling and Serialization,"The development and implementation of labeling strategies and serialization systems to ensure accurate product identification, traceability, and compliance with regulatory requirements, including unique codes for tracking and preventing counterfeiting.",CLINICAL
Medical Imaging Analysis,,CLINICAL
Antimicrobial Susceptibility Testing,"Microdilution, disk diffusion, E-test, and MIC determination",PRECLINICAL
Phage Display Library Screening,Selection of antibodies from pre-existing phage display libraries targeting specific antigens,PRECLINICAL
Single-Particle Cryo-Electron Microscopy (Cryo-EM),Sample preparation and single-particle analysis for high-resolution structure determination,PRECLINICAL
Environmental Risk Assessment,Predictive modeling and risk analysis for ecological and human health impacts of chemicals and industrial activities,BOTH
User Research in Product Design,,BOTH
Dental and Oral Care,,CLINICAL
Neuronal Cell Culture,"Neuronal cell culture; assays for neurotoxicity, synaptic function, and neuroinflammation",PRECLINICAL
Particle Size Distribution (PSD),,PRECLINICAL
Enzyme Activity Assays,Analysis of enzyme kinetics,PRECLINICAL
Industrial Product Design,,PRECLINICAL
Ferrets,,PRECLINICAL
Liver Disease Model,,PRECLINICAL
Ageing,,PRECLINICAL
Assessment of Medical Devices,,BOTH
Controlled Release Formulations,"The development of drug formulations designed to release active ingredients at a controlled rate over time, enhancing therapeutic effectiveness, reducing dosing frequency, and improving patient compliance.",BOTH
Differential Scanning Calorimetry (DSC),"Measurement of heat flow associated with phase transitions in biomolecules to study protein folding, stability, and ligand binding effects",PRECLINICAL
Inflammation Models,In vitro and in vivo models for studying autoimmune diseases,PRECLINICAL
Epitranscriptomics,"Study of RNA modifications, their impact on gene expression and role in disease and development",PRECLINICAL
Nutraceutical Clinical Trials,Design and execution of clinical studies to evaluate the health benefits and safety of nutraceutical products,CLINICAL
Medical Device Prototype Development,"Creating a tangible, working model of a potential medical device to test its feasibility, function, and marketability",PRECLINICAL
Raw Material Testing,"The analysis of raw materials used in manufacturing to ensure they meet quality and safety standards, verifying their identity, purity, and compliance with specifications before use in production.",BOTH
Clinical Trial Consulting Services,"Expert advice on R&D strategy, trial design, regulatory compliance, and therapeutic areas.",CLINICAL
BSL-2 and BSL-3 Laboratory Capabilities,For handling and testing potentially hazardous microorganisms,PRECLINICAL
Interventional Radiology Models,,PRECLINICAL
Pesticide and Insecticide Testing,,PRECLINICAL
Biological Tissue Analysis (BIOTA),,PRECLINICAL
Plasma Protein Binding Assays,"Determining the fraction of drug bound to plasma proteins, impacting distribution",PRECLINICAL
Toxicokinetics,Assessment of systemic exposure to a drug and its correlation with toxicological findings,PRECLINICAL
Patient PK and Clinical Endpoint Studies,,CLINICAL
Circulating Tumour Cell (CTC) Diagnostic,,CLINICAL
DNA Extraction,"Isolating DNA from various biological samples, such as blood, tissue, or cells, to obtain pure DNA for downstream applications like sequencing, cloning, or analysis.",BOTH
Autoimmunity and Serology Profiling,,CLINICAL
Electrical Components Analysis,,BOTH
Biocompatibility Testing of Medical Devices,"For medical devices, assessing the compatibility of materials with biological systems to ensure they are safe for their intended use.",PRECLINICAL
Hybridoma Generation and Screening,"Fusion of B cells with myeloma cells to produce hybridomas, followed by screening for specific antibody production",PRECLINICAL
Petrochemical Analysis,,BOTH
Encapsulation Technologies,"The techniques used to enclose active ingredients or sensitive compounds within a protective shell or matrix, aiming to improve stability, control release, and target delivery of pharmaceuticals, nutraceuticals, or other substances.",BOTH
Corrosion and Abrasion Testing,,BOTH
Metallography Testing,,BOTH
Carbohydrate Analysis,,BOTH
Sialic Acid Analysis,,BOTH
Nitrosamines Analysis,,BOTH
In Vitro Cell Therapy Studies,,PRECLINICAL
Polymer Synthesis,"Creating custom polymers for various applications, including materials science and biotechnology",PRECLINICAL
Quantitative Proteomics,Measuring and comparing the quantities of proteins in different samples to study cellular processes and disease states.,PRECLINICAL
Gene Therapy Off Target Effect Analysis,Identifying and assessing unintended genomic modifications that occur outside the target site during gene therapy,BOTH
Market Access Services,,BOTH
Innate Immunity Animal Models,"These are animal models used to study the innate immune system, the body's first line of defense against infection, through genetically or experimentally modified organisms.",PRECLINICAL
Electron Paramagnetic Resonance (EPR)/Electron Spin Resonance (ESR),,PRECLINICAL
Periodontitis Model,,PRECLINICAL
Microbiological Testing of Nutraceuticals,"Testing for pathogens, spoilage organisms, and microbial contaminants in nutraceutical products",CLINICAL
Target Testing with Disease Models,Testing the efficacy of candidate drugs using relevant animal models,PRECLINICAL
Dermatological In Vivo Testing,,PRECLINICAL
Aptamer Engineering,,PRECLINICAL
DNA Pooled and Arried Library Services,,PRECLINICAL
Antibody Isotype switching,,PRECLINICAL
Human Antibody Discovery from Serum,,PRECLINICAL
Nanobody Production,"Generation of single-domain antibodies, typically from camelids",PRECLINICAL
Hygroscopicity Evaluation,,BOTH
Elemental Analysis,,BOTH
Extractables and Leachables Studies,,BOTH
Discriminating Dissolution Method Development,,BOTH
Residual Solvent Analysis,,BOTH
APIs Crystallization Process Development,,BOTH
Pre-clinical and CMC,,CLINICAL
APIs Solid Form Screening and Selection,,BOTH
Thermo-Physical Measurement,,BOTH
Solubility Profiling and Enhancement,Solid Dispersion Techniques: Utilizing carriers to increase the solubility of poorly soluble drugs.Cyclodextrin Complexation: Using cyclodextrins to enhance solubility and stability.Micronization: Reducing particle size to improve solubility and dissolution rate.,BOTH
Rare Disease,,CLINICAL
Bioinformatics for Biomarker Analysis,"Use of computational tools to analyze large datasets from genomics, proteomics, and metabolomics studies",BOTH
"Custom Buffers, Solutions and Reagents Manufacturing",,BOTH
Diabetic and Metabolic Models,,PRECLINICAL
Cytotoxicity Testing,In vitro cytotoxicity assays for evaluating drug safety.,BOTH
Rheumatology,,CLINICAL
Hormone Testing,,CLINICAL
Neurotransmitter Testing,,CLINICAL
Immune Cell Proliferation Assays,"Immune cell proliferation assays assess the rate of growth and division of immune cells, often used to evaluate immune responses or the effect of drugs on these cells.",BOTH
Whole Genome Sequencing,High-throughput sequencing of entire genomes; resequencing for variant identification,BOTH
Specialty Enzymes and Probiotics Manufacturing,,BOTH
"Custom CHO, Hybridoma and Insect Cells Media Manufacturing",,BOTH
"Flexographic printing, Film and Laminate Manufacturing",,BOTH
Molding and Processing,,BOTH
Modified Oligonucleotide Synthesis,"Modifications like fluorescent labeling, phosphorylation, and conjugation",BOTH
10X Genomics Provider,"Services utilizing 10X Genomics technology, including single-cell and spatial transcriptomics, to provide high-resolution insights into cellular diversity, gene expression, and tissue architecture.",PRECLINICAL
DNA Methylation Sequencing (Bisulfite Sequencing) Analysis,Evaluating DNA methylation patterns using bisulfite sequencing to understand gene expression regulation and epigenetic changes.,PRECLINICAL
Environmental Toxicology,Assessment of the impact of substances on the environment and wildlife,PRECLINICAL
Laser Microdissection and Pressure Catapulting (LMPC),For single-cell analysis,PRECLINICAL
Target Functional Assays,"For assessing the impact of target modulation on relevant cellular processes, including proliferation, migration, and signal transduction",PRECLINICAL
Pharmacovigilance,Monitoring drug safety in clinical trials,BOTH
Circulating tumor DNA (ctDNA) Diagnostic,,CLINICAL
Allergen Testing,"Diagnostic tests to identify specific allergens causing allergic reactions, often through skin prick tests or serum-specific IgE tests.",CLINICAL
Bilayer Formulations,,CLINICAL
Taste Masking,,CLINICAL
Container-Closure Compatibility Studies,,CLINICAL
Lateral Flow Assay (LFA) Test Manufacturing,,BOTH
Contaminant Testing,"The detection and analysis of harmful substances, such as heavy metals, pathogens, or industrial chemicals, in food products to ensure they are safe for consumption.",BOTH
Stability Testing,"The evaluation of a product's stability over time under various environmental conditions to ensure it maintains its quality, efficacy, and safety throughout its shelf life.",BOTH
Industrial Hygiene Testing,"The assessment of workplace environments to identify and measure exposure to hazardous substances, ensuring compliance with safety standards and protecting worker health.",BOTH
Extractables and Leachables (E&L) Studies,Evaluating potential interactions between drug products and packaging materials,BOTH
Antibody-Drug Conjugate (ADC) Production,"Design and engineering of ADCs with optimal antibody selectivity, linker stability, and drug payload potency, with cell culture, and purification processes",BOTH
Small RNA and Non-Coding RNA Sequencing,"Sequencing, analysis, and study of small RNAs, such as miRNAs, siRNAs, piRNAs, and lncRNAs",PRECLINICAL
